{
  "task_schema_version": 1,
  "id": "T-0021",
  "title": "Organisations, memberships, teams, invitations, roles",
  "objective": "Multi-tenant organisation model: personal org on first login, multi-org membership, members, teams, invitations (link/token) with role assignment on acceptance, custom org roles, settings, billing hooks, org audit.",
  "acceptance_criteria": [
    "Invitation flow test: invite -> accept as invited email -> membership with assigned role",
    "Owner protections: last owner cannot be removed or demoted (test)"
  ],
  "non_goals": [],
  "dependencies": [
    "T-0020"
  ],
  "components": [],
  "likely_files": [],
  "constraints": [],
  "validation": [
    "cargo test -p app-api --test organizations"
  ],
  "risk": "medium",
  "task_class": "feature",
  "required_capabilities": [],
  "context_class": "medium",
  "status": "completed",
  "blocked_reason": null,
  "template": null,
  "result": ".ai/context/summaries/T-0021.result.json",
  "history": [
    {
      "at": "2026-10-04T08:03:03Z",
      "event": "created",
      "from": null,
      "to": "queue",
      "note": null
    },
    {
      "at": "2026-10-04T09:59:33Z",
      "event": "transition",
      "from": "queue",
      "to": "active",
      "note": null
    },
    {
      "at": "2026-10-04T09:59:33Z",
      "event": "transition",
      "from": "active",
      "to": "completed",
      "note": "completed"
    }
  ]
}
