{
  "task_schema_version": 1,
  "id": "T-0008",
  "title": "Redis/Dragonfly cache layer",
  "objective": "Cache abstraction with Redis default and Dragonfly compatibility: response cache, sessions, distributed rate-limit counters, locks, stampede prevention; cache never canonical.",
  "acceptance_criteria": [
    "Cache integration tests pass against Redis and Dragonfly",
    "Redis outage degrades to uncached operation (test)",
    "Cached-read benchmark recorded",
    "Redis session cache (if enabled) falls back to PostgreSQL on Redis outage without failing open (moved from T-0019)"
  ],
  "non_goals": [],
  "dependencies": [
    "T-0004"
  ],
  "components": [],
  "likely_files": [],
  "constraints": [],
  "validation": [
    "TEST_REDIS_URLS=redis://127.0.0.1:56379,redis://127.0.0.1:56380 cargo test -p app-cache"
  ],
  "risk": "medium",
  "task_class": "feature",
  "required_capabilities": [],
  "context_class": "medium",
  "status": "completed",
  "blocked_reason": null,
  "template": null,
  "result": ".ai/context/summaries/T-0008.result.json",
  "history": [
    {
      "at": "2026-10-04T07:54:01Z",
      "event": "created",
      "from": null,
      "to": "queue",
      "note": null
    },
    {
      "at": "2026-10-04T12:26:19Z",
      "event": "transition",
      "from": "queue",
      "to": "active",
      "note": null
    },
    {
      "at": "2026-10-04T12:26:19Z",
      "event": "transition",
      "from": "active",
      "to": "completed",
      "note": "completed"
    }
  ]
}
